{
  "schemaVersion": 1,
  "name": "AiCoding Tagging Policy",
  "platformTagPattern": "^v(?![0-9]{4}\\.)[0-9]+\\.[0-9]+\\.[0-9]+$",
  "kitTagPattern": "^kit/[A-Za-z0-9._-]+/v(?![0-9]{4}\\.)[0-9]+\\.[0-9]+\\.[0-9]+$",
  "milestoneTagPattern": "^milestone/[0-9]{4}\\.[0-9]{2}\\.[0-9]{2}-[A-Za-z0-9._-]+$",
  "nonCurrentDateTagPattern": "^v[0-9]{4}\\.[0-9]{2}\\.[0-9]{2}(-[A-Za-z0-9._-]+)?$",
  "rules": [
    "Platform releases use vMAJOR.MINOR.PATCH only and exclude date tags.",
    "Kit releases use kit/<kit-id>/vMAJOR.MINOR.PATCH.",
    "Milestones use milestone/YYYY.MM.DD-<name>.",
    "Do not force delete or reuse immutable release tags.",
    "Do not push tag alignment results without explicit confirmation."
  ]
}